"","Sri Lanka Deposit Insurance and Liquidity Support Scheme Regulations",""
"","Amendment to the Sri Lanka Deposit Insurance Scheme Regulations, No. 1 of 2010",""
"Citation","1.","these regulations shall be cited as the “sri lanka deposit Insurance and liquidity"
"","","support scheme regulations, No. 1 of 2021”."
"Amendment to the principal","2.","the sri lanka deposit Insurance scheme regulations, No. 1 of 2010 published"
"regulation","","in Gazette Extraordinary No. 1673/11 of 28 september, 2010, are hereby"
"","","amended, as follows:-"
"","","(a)  In regulation 9 thereof, by the repeal of paragraph 9.4 of that regulation and"
"","","the substitution of the following paragraph:-"
