"Part III","Administrative Measures Adopted by the Government and the Monetary Board during the Year"
"Ref.	No.:	34/07/029/0001/002","13 September 2021"
"Payment	and	Settlement	Systems	Circular	No.	09/2021",""
"To: All participants of LankaSettle System",""
"","SUBJECT: NEW VERSION OF THE LANKASETTLE SYSTEM RULES - VERSION 2.2"
"","A new version of the LankaSettle System Rules has been published by the Gazette Notification No. 2213/2 dated 01st February"
"2021, incorporating amendments up to 31st December 2020. It is published in the Central Bank Official Website and can be",""
"access through the following links.",""
