"Part III","Administrative Measures Adopted by the Government and the Monetary Board during the Year"
"Circular No. 01 of 2021","13 January 2021"
"","SUSPENSION OF RECOVERY ACTIONS AGAINST"
"","SMALL AND MEDIUM ENTERPRISE (SME) PADDY MILLERS"
"Considering the Government initiatives to support the SME Paddy Millers amidst COVID-19 pandemic for the upcoming harvesting",""
"seasons, licensed commercial banks and licensed specialised banks (hereinafter referred to as licensed banks), are required to",""
"suspend recovery actions against SME Paddy Millers for a period of six months commencing from 1 January 2021 as specified",""
"below.",""
"(1)  In the case where a licensed bank has commenced or given notice of recovery action under the provisions of the Recovery",""
"","of Loans by Banks (Special Provisions) Act, No. 4 of 1990 or Mortgage Act No. 06 of 1949 as amended or Finance Leasing"
