"Part I: Application Form for Appointment of an Expatriate Officer","",""
"1.","Name of the bank",""
"2.","Name of the expatriate officer",""
"3.","Current designation of the expatriate officer in the parent bank (if applicable)",""
"4.","Designation to be filled in Sri Lanka",""
"5.","Responsibilities/projects assigned to the expatriate officer",""
"6.","Duration of the posting/contract/project",""
"7.","Projections for specific business/expected deliverables from the expatriate officer (including Key Performance 
Indicators (KPI) and target dates for each KPI)",""
"8.","Any other information relevant to the appointment (e.g. succession plan)",""
