"Purpose","No. of 
approvals","Value in 
USD
mn"
"GOSL to issue Sovereign guarantees","1","175.00"
"Resident Companies to invest abroad","3","7.87"
"Resident Companies to issue bank/
corporate guarantees in favour of 
residents outside Sri Lanka","6","13.05"
"ADs to open and maintain Special 
Foreign Currency Accounts","20","Not 
applicable"
"ADs to process certain miscellaneous 
foreign exchange transactions that 
are not covered from the general 
permissions granted under FEA","305","Not 
applicable"
