"Part IV","","Major Legislative Enactments of 2022"
"","(b)","the  transfer  is  necessary  for  the  performance  of  a  contract  between  the  data  subject  and  the  controller  or  the"
"","","implementation of any pre contractual measures taken by the controller at the request of the data subject; or"
"","","(c)   the transfer is necessary for the establishment, exercise or defence of legal claims relating to the data subject; or"
"","","(d)   the transfer is necessary for reasons of public interest as defined in item (g) of Schedule I of this Act; or"
"","","(e)   the transfer is necessary to respond to an emergency that threatens the life, health, or safety of the data subject or another"
"","","person and where the data subject or his legal guardian is physically or legally incapable of giving consent; or"
"","(f)","such processing is permitted under any other conditions as may be prescribed under this Act."
