"Administrative Measures Adopted by the Government and the Monetary Board during the Year","","","Part III"
"4.","Effective date","4.1","The Directions will be effective from 01.10.2022. Accordingly, all FCs shall comply with"
"","","","the requirements of these Directions with effect from 01.10.2022 for all new depositors"
"","","","subject to the transitional provisions stated in Section 5 below."
"5.","Transitional provisions","5.1","All  FCs  shall  complete  recording  of  UINs  of  all  existing  depositors  in  terms  of  these"
"","","","Directions by 31.12.2023."
