"WHO","World Health Organization","WRS","Web-based Recruitment System"
"WHT","Withholding Tax","WTI","West Texas Intermediate"
"WIPO","World Intellectual Property Office","WTO","World Trade Organization"
"WMD","Weapons of Mass Destruction","WTTC","World Travel and Tourism Council"
"W & OP","Widows’ and Orphans’ Pension","WUSL","Wayamba University of Sri Lanka"
"WPI","Wholesale Price Index","WWF","Workers’ Welfare Fund"
"WR & OP","Widowers’ and Orphans’ Pension","YOY","Year On Year"
"WRMDP","Western Region Megapolis Development Plan","ZBB","Zero Based Budgeting"
